{
  "$schema": "https://json-schema.org/draft/2020-12/schema",
  "$id": "https://torus-field-studio.dev/schemas/run-spec/v1.schema.json",
  "title": "TORUS run specification",
  "type": "object",
  "required": ["schema_version", "engine", "seed", "grid"],
  "properties": {
    "schema_version": {"const": "1.0.0"},
    "engine": {"enum": ["analytic", "local_brot", "tld"]},
    "seed": {"type": "integer", "minimum": 0},
    "domain_id": {"type": "string"},
    "claim_level": {"enum": ["ILLUSTRATIVE_ANALYTIC", "COMPUTED_DYNAMICAL", "TLD_DERIVED", "EXTERNALLY_VALIDATED"]},
    "grid": {
      "type": "object",
      "required": ["width", "height"],
      "properties": {
        "width": {"type": "integer", "minimum": 4, "maximum": 1024},
        "height": {"type": "integer", "minimum": 4, "maximum": 1024}
      },
      "additionalProperties": false
    },
    "parameters": {"type": "object"},
    "classification_rules": {
      "type": "object",
      "properties": {
        "separation_threshold": {"type": "number"},
        "nss_threshold": {"type": "number"},
        "survival_threshold": {"type": "number", "minimum": 0, "maximum": 1},
        "recovery_threshold": {"type": "number", "minimum": 0, "maximum": 1},
        "escape_threshold": {"type": "number", "minimum": 0, "maximum": 1},
        "bounded_iteration": {"type": "integer", "minimum": 1}
      },
      "additionalProperties": false
    },
    "null_policy": {
      "type": "object",
      "required": ["kind", "count"],
      "properties": {
        "kind": {"enum": ["none", "preserve_multiset_shuffle"]},
        "count": {"type": "integer", "minimum": 0, "maximum": 10000},
        "seed": {"type": "integer", "minimum": 0}
      },
      "additionalProperties": false
    }
  },
  "additionalProperties": false
}
