{
  "claim_level": "COMPUTED_DYNAMICAL",
  "classification_rules": {},
  "domain_id": "torus-tld-i-baseline-v1",
  "engine": "tld",
  "grid": {"height": 20, "width": 561},
  "null_policy": {"count": 0, "kind": "none", "seed": 42},
  "parameters": {
    "doi": "10.5281/zenodo.18080090",
    "lane": "HISTORICAL_PUBLISHED_RELEASE_REPRODUCTION",
    "profile": "combined"
  },
  "schema_version": "1.0.0",
  "seed": 42
}
